26,Nord-Pas-de-Calais,59 - Nord,M.,Jean-Pierre,Allossery,PS,Député du Nord*Maire de Hazebrouck,Député,1,,0,0,1,,,"Président du SIECF, Syndicat Intercommunal d'électrification des communes de Flandre*Président du Syndicat mixte du Pays Coeur de Flandre, en charge du SCoT *Président du Syndicat mixte du Pays CÅ“ur de Flandre",2*2*2,10*8,Hazebrouck,24,http://cumular.lexpress.fr/back_end/images/uploads/jean-pierre-allossery.jpg,1,0,,,0,0,0,0,
251,Ile-de-France,94 - Val-de-Marne,M.,Jean-Jacques,Bridey,PS,Député du Val-de-Marne*Maire de Fresnes*Conseiller délégué de la communauté d'agglomération du Val de Bièvre,Député,1,,0,0,1,http://psfresnes.fr/fichiers/discours.pdf,,"Président de la SEMAF, Société d'économie mixte locale d'aménagement de Fresnes*Président du SMBVB, Syndicat mixte du bassin versant de la Bièvre",2*2,10*8*2,Fresnes,24,http://cumular.lexpress.fr/back_end/images/uploads/jean-jacques-bridey.jpg,1,0,,,0,0,0,0,
660,Réunion,974 - Réunion,M.,Jean-Claude,Fruteau,PS,Député de la Réunion*Maire de Saint-Benoît,Député,1,,0,0,1,http://www.zinfos974.com/Municipales-2014-Les-candidats-socialistes-designes_a62731.html,,"Président du Conseil de surveillance du Groupe hospitalier Est Réunion*Président de la SEMAC (974), Société d'économie mixte d'aménagement et de construction*Président de la SPL est Réunion développement",2*2*2,10*8,Saint-Benoît,24,http://cumular.lexpress.fr/back_end/images/uploads/jean-claude-fruteau.jpg,1,0,,,0,0,0,0,
1495,Ile-de-France,75 - Paris,M.,Daniel,Vaillant,PS,Député de Paris*Maire du XVIIIe arrondissement de Paris*Conseiller de Paris,Député,1,,0,0,1,,,NULL,NULL,10*10*4,XVIIIe arrondissement de Paris,24,http://cumular.lexpress.fr/back_end/images/uploads/daniel-vaillant.jpg,1,0,,,0,0,0,0,
1009,Ile-de-France,75 - Paris,Mme,Annick,Lepetit,PS,Députée de Paris*Adjointe au maire de Paris*Conseillère de Paris,Député,1,,0,0,1,http://www.leparisien.fr/espace-premium/paris-75/annick-lepetit-candidate-dans-le-xviie-19-09-2013-3149073.php,,Présidente de la Société publique locale d'aménagement Paris-Batignolles Aménagement*Secrétaire nationale du PS aux Transports,2*3,10*5*4,Paris,24,http://cumular.lexpress.fr/back_end/images/uploads/annick-lepetit.jpg,0,1,,,0,0,0,0,
1079,Rhône-Alpes,26 - Drôme,M.,Hervé,Mariton,UMP,Député de la Drôme*Maire de Crest,Député,1,,0,0,1,http://www.drome-hebdo.fr/blog/2014/01/27/herve-mariton-officiellement-candidat-a-sa-succession/,,"Président du Conseil de surveillance du Centre hospitalier de Crest*Délégué général au projet de l'UMP*Secrétaire national de l'UMP, chargé des Armées et de la Défense",2*3*3,10*6,Crest,24,http://cumular.lexpress.fr/back_end/images/uploads/herve-mariton.jpg,1,0,,,0,0,0,0,
1082,Ile-de-France,91 - Essonne,M.,Franck,Marlin,UMP,Député de l'Essonne*Maire d'Etampes*Conseiller délégué de la communauté de communes de l'Etampois Sud Essonne,Député,1,,0,0,1,http://www.larep.fr/loiret/actualite/pays/pithiverais-beauce/pithiviers/2014/01/12/franck-marlin-candidat-aux-elections-municipales_1831960.html,,"Président du Conseil de surveillance du Centre hospitalier Sud Essonne*Président du SIREDOM, Syndicat intercommunal pour la revalorisation et l'élimination des déchets et des ordures ménagères",2*2,10*8*2,Etampes,24,http://cumular.lexpress.fr/back_end/images/uploads/franck-marlin.jpg,1,0,,,0,0,0,0,
132,Ile-de-France,94 - Val-de-Marne,M.,Jacques-Alain,Bénisti,UMP,Député du Val-de-Marne*Maire de Villiers-sur-Marne,Député,1,,0,0,1,http://www.jabenisti.info/article-lancement-de-la-campagne-de-jacques-alain-benisti-pour-les-elections-municipales-de-mars-2014-122060513.html,,"Président directeur général de la SEMAVIL, Société d'économie mixte d'aménagement de la ville de Villiers-sur-Marne*Président du Centre interdépartemental de gestion de la petite couronne de la région Ile-de-France*Conseiller politique de l'UMP",2*2*2,10*8,Villiers-sur-Marne,24,http://cumular.lexpress.fr/back_end/images/uploads/jacques-alain-benisti.jpg,1,0,,,0,0,0,0,
153,Picardie,02 - Aisne,M.,Xavier,Bertrand,UMP,Député de l'Aisne*Maire de Saint-Quentin*Conseiller délégué de la communauté d'agglomération de Saint-Quentin,Député,1,,0,0,1,? http://www.courrier-picard.fr/region/saint-quentin-xavier-bertrand-candidat-pressenti-ia201b0n299667,,Conseiller politique de l'UMP,2,10*10*2,Saint-Quentin,24,http://cumular.lexpress.fr/back_end/images/uploads/xavier-bertrand.jpg,1,0,,,0,0,0,0,
723,Ile-de-France,75 - Paris,M.,Claude,Goasguen,UMP,Député de Paris*Maire du XVIe arrondissement de Paris*Conseiller de Paris,Député,1,,0,0,1,http://www.leparisien.fr/municipales-2014/paris-75/municipales-a-paris-nkm-devoile-ses-listes-communes-avec-l-udi-et-le-modem-21-12-2013-3430407.php,,NULL,NULL,10*10*4,XVIe arrondissement de Paris,24,http://cumular.lexpress.fr/back_end/images/uploads/claude-goasguen.jpg,1,0,,,0,0,0,0,
740,Ile-de-France,75 - Paris,M.,Philippe,Goujon,UMP,Député de Paris*Maire du XVe arrondissement de Paris*Conseiller de Paris,Député,1,,0,0,1,http://www.rtl.fr/actualites/info/politique/article/municipales-2014-ces-candidats-qui-affronteront-des-poids-lourds-de-la-politique-7765423811,,NULL,NULL,10*10*4,XVe arrondissement de Paris,24,http://cumular.lexpress.fr/back_end/images/uploads/philippe-goujon.jpg,1,0,,,0,0,0,0,
1386,Centre,18 - Cher,M.,Nicolas,Sansu,PCF,Député du Cher*Maire de Vierzon*Conseiller délégué de la communauté de communes Vierzon-Sologne-Berry,Député,1,,0,0,1,http://www.leberry.fr/cher/actualite/pays/pays-de-vierzon/2013/12/13/le-maire-nicolas-sansu-lance-sa-campagne-pour-l-election-municipale-2014_1800673.html,,"Président du Conseil de surveillance du Centre hospitalier de Vierzon*Président de la SEMVIE, société d'économie mixte du Pays de Vierzon",2*2,10*8*1,Vierzon,23,http://cumular.lexpress.fr/back_end/images/uploads/nicolas-sansu.jpg,1,0,,,0,0,0,0,
1547,Rhône-Alpes,01 - Ain,M.,Michel,Voisin,UMP,Député de l'Ain*Maire de Replonges*Conseiller délégué de la communauté de communes du Pays de Bâgé*Conseiller régional de Rhône-Alpes,Député,1,,0,0,1,,,Président du Syndicat mixte Bresse - Revermont - Val de Saône*Président de l'Association des maires de l'Ain,2*1,10*5*1*4,Replonges,23,http://cumular.lexpress.fr/back_end/images/uploads/michel-voisin.jpg,1,0,,,0,0,0,0,
1435,Provence-Alpes-Côte d'Azur,06 - Alpes-Maritimes,Mme,Michèle,Tabarot,UMP,Députée des Alpes-Maritimes*Maire du Cannet,Député,1,,0,0,1,?,,"Présidente de l'ANDL, Association nationale pour la démocratie locale*Secrétaire générale de l'UMP",2*3,10*8,Cannet,23,http://cumular.lexpress.fr/back_end/images/uploads/michele-tabarot.jpg,1,0,,,0,0,0,0,
187,Provence-Alpes-Côte d'Azur,84 - Vaucluse,M.,Jacques,Bompard,DVD,Député du Vaucluse*Maire d'Orange,Député,1,,0,0,1,http://www.franceinfo.fr/politique/orange-cinq-candidats-veulent-supprimer-les-machines-a-voter-1281067-2014-01-14,,Président du Conseil de surveillance du Centre hospitalier Louis Giorgi*Président de la Ligue du Sud,2*2,10*8,Orange,22,http://cumular.lexpress.fr/back_end/images/uploads/jacques-bompard.jpg,1,0,,,0,0,0,0,
75,Haute-Normandie,76 - Seine-Maritime,M.,Guillaume,Bachelay,PS,Député de la Seine-Maritime*Conseiller municipal de Cléon*Conseiller régional de Haute-Normandie,Député,0,,0,0,0,,,Membre du Bureau national du PS *Secrétaire national du PS à la Coordination,2*3,10*3*4,Cléon,22,http://cumular.lexpress.fr/back_end/images/uploads/guillaume-bachelay.jpg,0,0,,,0,0,0,0,
242,Ile-de-France,77 - Seine-et-Marne,M.,Emeric,Bréhier,PS,Député de la Seine-et-Marne*Adjoint au maire de Chelles*Conseiller délégué de la communauté d'agglomération Marne et Chantereine,Député,1,,0,0,1,,,Membre du Bureau national du PS*Secrétaire national du PS à l'Education,2*3,10*5*2,Chelles,22,http://cumular.lexpress.fr/back_end/images/uploads/emeric-brehier.jpg,0,1,,,0,0,0,0,
1214,Languedoc-Roussillon,11 - Aude,M.,Jean-Claude,Perez,PS,Député de l'Aude*Maire de Carcassonne*Conseiller délégué de la communauté d'agglomération Carcassonne Agglo,Député,1,,0,0,1,"http://www.lindependant.fr/2013/11/20/municipales-la-liste-des-candidats-ps-de-jean-claude-perez,1814645.php",,Président du Conseil de surveillance du Centre hospitalier Antoine Gayraud,2,10*8*2,Carcassonne,22,http://cumular.lexpress.fr/back_end/images/uploads/jean-claude-perez.jpg,1,0,,,0,0,0,0,
1187,Ile-de-France,93 - Seine-Saint-Denis,M.,Michel,Pajon,PS,Député de la Seine-Saint-Denis*Maire de Noisy-le-Grand,Député,1,,0,0,1,? http://www.leparisien.fr/informations/la-droite-se-dechire-encore-a-noisy-le-grand-10-12-2013-3393133.php,,"Président directeur général de la SOCAREN, Société publique locale d'aménagement de rénovation et d'équipement de Noisy-le-Grand",2,10*10,Noisy-le-Grand,22,http://cumular.lexpress.fr/back_end/images/uploads/michel-pajon.jpg,1,0,,,0,0,0,0,
954,Bretagne,22 - Côtes-d\\'Armor,Mme,Viviane,Le Dissez,PS,Députée des Côtes-d'Armor*Maire de Plancoêt,Député,1,,0,0,1,,,Présidente du Conseil d\\'administration du Conservatoire de l\\'espace littoral et des rivages lacustres,2,10*5,Plancoêt,17,http://cumular.lexpress.fr/back_end/images/uploads/viviane-le-dissez.jpg,1,0,,,0,0,0,0,
478,Midi-Pyrénées,31 - Haute-Garonne,Mme,Carole,Delga,PS,Députée de la Haute-Garonne*Maire de Martres-Tolosane*Conseillère régionale de Midi-Pyrénées,Député,1,,0,0,1,http://www.ladepeche.fr/article/2014/01/23/1800821-martres-tolosane-carole-delga-presente-les-chantiers-et-sa-candidature.html,,Secrétaire nationale du PS au Logement et à l'égalité des territoires,3,10*5*4,Martres-Tolosane,22,http://cumular.lexpress.fr/back_end/images/uploads/carole-delga.jpg,1,0,,,0,0,0,0,
657,Ile-de-France,92 - Hauts-de-Seine,M.,Jean-Christophe,Fromantin,UDI,Député des Hauts-de-Seine*Maire de Neuilly-sur-Seine,Député,1,,0,0,1,http://tempsreel.nouvelobs.com/politique/20131128.OBS7490/municipales-fromantin-lance-un-label-candidat-libre.html,,Vice-président de l'UDI,2,10*10,Neuilly-sur-Seine,22,http://cumular.lexpress.fr/back_end/images/uploads/jean-christophe-fromantin.jpg,1,0,,,0,0,0,0,
1158,Rhône-Alpes,38 - Isère,M.,Alain,Moyne-Bressand,UMP,"Député de l'Isère*Maire de Crémieu*Conseiller délégué de la communauté de communes de l'Isle-Crémieu*Conseiller général de l'Isère, canton de Crémieu",Député,1,,0,0,1,http://www.ledauphine.com/isere-nord/2014/01/13/alain-moyne-bressand-de-nouveau-candidat,,Président de la SEM de la ville de Crémieu,2,10*5*1*4,Crémieu,22,http://cumular.lexpress.fr/back_end/images/uploads/alain-moyne-bressand.jpg,1,0,,,0,0,0,0,
1162,Ile-de-France,78 - Yvelines,M.,Jacques,Myard,UMP,Député des Yvelines*Maire de Maisons-Laffitte,Député,1,,0,0,1,http://www.leparisien.fr/espace-premium/yvelines-78/jacques-myard-candidat-a-sa-succession-a-maisons-laffitte-03-12-2013-3370869.php,,Président du Conseil d'administration du Centre hospitalier des courses (Maisons-Laffitte)*Président de la Société d'économie mixte de construction de Maisons-Laffitte,2*2,10*8,Maisons-Laffitte,22,http://cumular.lexpress.fr/back_end/images/uploads/jacques-myard.jpg,1,0,,,0,0,0,0,
1467,Provence-Alpes-Côte d'Azur,13 - Bouches-du-Rhône,M.,Dominique,Tian,UMP,Député des Bouches-du-Rhône*Maire de 4e secteur de Marseille (VIe et VIIIe arr.),Député,1,,0,0,1,"http://www.lindependant.fr/2014/01/29/frederick-bousquet-candidat-aux-municipales-a-marseille,1841365.php",,Conseiller politique de l'UMP,2,10*10,4e secteur de Marseille (VIe et VIIIe arr.),22,http://cumular.lexpress.fr/back_end/images/uploads/dominique-tian.jpg,1,0,,,0,0,0,0,
930,Aquitaine,64 - Pyrénées-Atlantiques,M.,Jean,Lassalle,Modem,"Député des Pyrénées-Atlantiques*Maire de Lourdios-Ichère*Conseiller délégué de la communauté de communes de la vallée d'Aspe*Conseiller général des Pyrénées-Atlantiques, canton d'Accous",Député,1,,0,0,1,? http://www.leparisien.fr/municipales-2014/personnalites/jean-lassalle-s-interroge-sur-sa-candidature-aux-municipales-16-12-2013-3414027.php,,"Président de l'IPHB, Institution patrimoniale du Haut-Béarn*Président de l'APMM, Association des populations des montagnes du monde",2*1,10*3*1*4,Lourdios-Ichère,21,http://cumular.lexpress.fr/back_end/images/uploads/jean-lassalle.jpg,1,0,,,0,0,0,0,
571,Rhône-Alpes,07 - Ardèche,M.,Olivier,Dussopt,PS,Député de l'Ardèche*Maire d'Annonay*Conseiller délégué de la communauté de communes du Bassin d'Annonay,Député,1,,0,0,1,http://www.olivierdussopt.fr/blog/2014/01/premier-tract-de-campagne-pour-les-%C3%A9lections-municipales-annonay-avance.html,,Président du Conseil de surveillance du Centre hospitalier d'Annonay*Président du Syndicat mixte Ardèche verte,2*2,10*6*1,Annonay,21,http://cumular.lexpress.fr/back_end/images/uploads/olivier-dussopt.jpg,1,0,,,0,0,0,0,
1519,Languedoc-Roussillon,30 - Gard,M.,Fabrice,Verdier,PS,Député du Gard*Maire de Fons-sur-Lussan*Conseiller délégué de la communauté de communes du Pays d'Uzès*Conseiller régional de Languedoc-Roussillon,Député,1,,0,0,1,?,,Président de Sud de France Développement,3,10*3*1*4,Fons-sur-Lussan,21,http://cumular.lexpress.fr/back_end/images/uploads/fabrice-verdier.jpg,1,0,,,0,0,0,0,
574,Lorraine,54 - Meurthe-et-Moselle,M.,Christian,Eckert,PS,Député de la Meurthe-et-Moselle*Maire de Trieux*Conseiller délégué de la communauté de communes du Bassin de Landres,Député,1,,0,0,1,?,,Rapporteur général du budget à l'Assemblée nationale*Membre du Comité des finances locales,3*2,10*5*1,Trieux,21,http://cumular.lexpress.fr/back_end/images/uploads/christian-eckert.jpg,1,0,,,0,0,0,0,
1475,Rhône-Alpes,69 - Rhône,M.,Jean-Louis,Touraine,PS,Député du Rhône*Adjoint au maire de Lyon*Conseiller délégué de la communauté urbaine du Grand Lyon,Député,1,,0,0,1,Non-exécutif http://www.leprogres.fr/rhone/2013/10/09/jean-louis-touraine-1er-adjoint-je-resterai-simplement-conseiller-municipal,,Président de Lyon parc auto*Président de France Transplant,2*2,10*5*2,Lyon,21,http://cumular.lexpress.fr/back_end/images/uploads/jean-louis-touraine.jpg,0,1,,,0,0,0,0,
255,Rhône-Alpes,38 - Isère,M.,François,Brottes,PS,Député de l'Isère*Maire de Crolles*Conseiller délégué de la communauté de communes du Pays du Grésivaudan,Député,1,,0,0,1,,,Président de la commission des affaires économiques de l'Assemblée nationale,3,10*6*2,Crolles,21,http://cumular.lexpress.fr/back_end/images/uploads/francois-brottes.jpg,1,0,,,0,0,0,0,
212,Haute-Normandie,76 - Seine-Maritime,M.,Christophe,Bouillon,PS,Député de la Seine-Maritime*Maire de Canteleu*Conseiller délégué de la communauté d'agglomération Rouen-Elbeuf-Austreberthe (CREA),Député,1,,0,0,1,,,Président du Conseil national du bruit,3,10*6*2,Canteleu,21,http://cumular.lexpress.fr/back_end/images/uploads/christophe-bouillon.jpg,1,0,,,0,0,0,0,
238,Rhône-Alpes,69 - Rhône,M.,Thierry,Braillard,PRG,Député du Rhône*Adjoint au maire de Lyon*Conseiller délégué de la communauté urbaine du Grand Lyon,Député,1,,0,0,1,? http://www.lyoncapitale.fr/Journal/Lyon/Politique/Elections/Municipales-2014/Gerard-Collomb-Etre-maire-de-Lyon-ne-s-improvise-pas,,Membre du Conseil exécutif du PRG,3,10*5*2,Lyon,20,http://cumular.lexpress.fr/back_end/images/uploads/thierry-braillard.jpg,0,1,,,0,0,0,0,
601,Aquitaine,47 - Lot-et-Garonne,M.,Matthias,Fekl,PS,Député du Lot-et-Garonne*Adjoint au maire de Marmande*Conseiller régional d'Aquitaine,Député,1,,0,0,1,?,,"Secrétaire national du PS aux Institutions, à la réforme et la modernisation de l'Etat",3,10*3*4,Marmande,20,http://cumular.lexpress.fr/back_end/images/uploads/matthias-fekl.jpg,0,1,,,0,0,0,0,
1538,Franche-Comté,70 - Haute-Saône,M.,Jean-Michel,Villaumé,PS,Député de la Haute-Saône*Maire de Héricourt*Conseiller délégué de la communauté de communes du Pays d'Héricourt,Député,1,,0,0,1,,,"Président du SMAU, Syndicat mixte de l'aire urbaine Belfort-Montbéliard-Héricourt-Delle",3,10*6*1,Héricourt,20,http://cumular.lexpress.fr/back_end/images/uploads/jean-michel-villaume.jpg,1,0,,,0,0,0,0,
170,Ile-de-France,95 - Val-d'Oise,M.,Jean-Pierre,Blazy,PS,Député du Val-d'Oise*Maire de Gonesse,Député,1,,0,0,1,http://www.leparisien.fr/espace-premium/val-d-oise-95/je-veux-tirer-la-ville-de-gonesse-vers-le-haut-21-11-2013-3335173.php,,Président du Conseil de surveillance du Centre hospitalier de Gonesse,2,10*8,Gonesse,20,http://cumular.lexpress.fr/back_end/images/uploads/jean-pierre-blazy.jpg,1,0,,,0,0,0,0,
1233,Ile-de-France,92 - Hauts-de-Seine,M.,Sébastien,Pietrasanta,PS,Député des Hauts-de-Seine*Maire d'Asnières-sur-Seine,Député,1,,0,0,1,http://www.lemonde.fr/municipales/article/2013/11/01/campagne-municipale-sur-fond-de-reglements-de-comptes-a-asnieres-sur-seine_3506539_1828682.html,,NULL,NULL,10*10,Asnières-sur-Seine,20,http://cumular.lexpress.fr/back_end/images/uploads/sebastien-pietrasanta.jpg,1,0,,,0,0,0,0,
904,Aquitaine,33 - Gironde,Mme,Conchita,Lacuey,PS,Députée de la Gironde*Adjointe au maire de Floirac*Conseillère déléguée de la communauté urbaine de Bordeaux,Député,1,,0,0,1,,,"Présidente du Conseil d'administration de l'Office public d'HLM Aquitanis*Présidente de l'ADIL 33, Agence départementale d'information sur le logement de la Gironde",3*2,10*3*2,Floirac,20,http://cumular.lexpress.fr/back_end/images/uploads/conchita-lacuey.jpg,0,1,,,0,0,0,0,
369,Pays de la Loire,44 - Loire-Atlantique,Mme,Marie-Françoise,Clergeau,PS,Députée de la Loire-Atlantique*Adjointe au maire de Nantes*Conseillère déléguée de la communauté urbaine Nantes métropole,Député,1,,0,0,1,,,Questeur de l'Assemblée nationale,3,10*5*2,Nantes,20,http://cumular.lexpress.fr/back_end/images/uploads/marie-francoise-clergeau.jpg,0,1,,,0,0,0,0,
1030,Nord-Pas-de-Calais,59 - Nord,Mme,Audrey,Linkenheld,PS,Députée du Nord*Adjointe au maire de Lille*Conseillère déléguée de la communauté urbaine Lille métropole,Député,1,,0,0,1,http://www.lavoixdunord.fr/region/lille-martine-aubry-devoile-les-61-noms-de-sa-liste-pour-ia19b0n1872091,,Secrétaire nationale adjointe du PS au Logement,3,10*5*2,Lille,20,http://cumular.lexpress.fr/back_end/images/uploads/audrey-linkenheld.jpg,0,1,,,0,0,0,0,
1381,Provence-Alpes-Côte d'Azur,06 - Alpes-Maritimes,M.,Rudy,Salles,UDI,Député des Alpes-Maritimes*Adjoint au maire de Nice*Conseiller délégué de la métropole Nice Côte d'Azur,Député,1,,0,0,1,http://www.metronews.fr/nice-cannes/municipales-a-nice-bettati-bientot-en-lice-avec-kandel-et-concas/mmku!S0SL8qTVhRU/,,Secrétaire de l'Assemblée nationale,3,10*5*2,Nice,20,http://cumular.lexpress.fr/back_end/images/uploads/rudy-salles.jpg,0,1,,,0,0,0,0,
695,Nord-Pas-de-Calais,59 - Nord,M.,Bernard,Gérard,UMP,Député du Nord*Maire de Marcq-en-Baroeul*Conseiller délégué de la communauté urbaine Lille métropole,Député,1,,0,0,1,http://www.lavoixdunord.fr/region/bernard-gerard-candidat-pour-un-dernier-mandat-a-marcq-ia22b49743n1540325,,NULL,NULL,10*8*2,Marcq-en-Baroeul,20,http://cumular.lexpress.fr/back_end/images/uploads/bernard-gerard.jpg,1,0,,,0,0,0,0,
1060,Aquitaine,33 - Gironde,M.,Noêl,Mamère,Verts,Député de la Gironde*Maire de Bègles,Député,1,,0,0,1,http://www.lexpress.fr/region/aquitaine/video-municipales-2014-a-begles-mamere-mise-sur-l-enracinement-durable_1290921.html,,"Président de la SAEMCIB, Société anonyme d'économie mixte de construction immobilière de Bègles",2,10*8,Bègles,20,http://cumular.lexpress.fr/back_end/images/uploads/noel-mamere.jpg,1,0,,,0,0,0,0,
1534,Languedoc-Roussillon,34 - Hérault,M.,Patrick,Vignal,PS,Député de l'Hérault*Adjoint au maire de Montpellier*Conseiller délégué de la communauté d'agglomération de Montpellier,Député,1,,0,0,1,?,,Président du GIP pour le développement social et urbain de l'agglomération de Montpellier,2,10*5*2,Montpellier,19,http://cumular.lexpress.fr/back_end/images/uploads/patrick-vignal.jpg,0,1,,,0,0,0,0,
1267,Midi-Pyrénées,31 - Haute-Garonne,Mme,Émilienne,Poumirol,PS,Députée de la Haute-Garonne*Maire de Donneville*Conseillère déléguée de la communauté d'agglomération du Sicoval,Député,1,,0,0,1,Non-exécutif http://www.ladepeche.fr/article/2013/06/10/1646508-donneville-vie-emilienne-poumirol-deputee-heureuse-etre.html,,Présidente du Syndicat intercommunal à vocation sociale des Portes du Lauragais,2,10*5*2,Donneville,19,http://cumular.lexpress.fr/back_end/images/uploads/emilienne-poumirol.jpg,1,0,,,0,0,0,0,
522,Languedoc-Roussillon,34 - Hérault,Mme,Fanny,Dombre-Coste,PS,Députée de l'Hérault*Conseillère municipale de Montpellier*Conseillère déléguée de la communauté d'agglomération de Montpellier,Député,0,,0,0,0,,,Présidente de la radio FM Plus,2,10*5*2,Montpellier,19,http://cumular.lexpress.fr/back_end/images/uploads/fanny-dombre-coste.jpg,0,0,,,0,0,0,0,
134,Bretagne,35 - Ille-et-Vilaine,M.,Thierry,Benoit,UDI,"Député de l'Ille-et-Vilaine*Adjoint au maire de Lécousse*Conseiller délégué de la communauté de communes Fougères communauté*Conseiller général de l'Ille-et-Vilaine, canton de Fougères-Sud",Député,1,,0,0,1,,,Président du Pays de Fougères,2,10*2*1*4,Lécousse,19,http://cumular.lexpress.fr/back_end/images/uploads/thierry-benoit.jpg,0,1,,,0,0,0,0,
917,Lorraine,54 - Meurthe-et-Moselle,M.,Jacques,Lamblin,UMP,Député de la Meurthe-et-Moselle*Maire de Lunéville*Conseiller délégué de la communauté de communes du Lunévillois,Député,1,,0,0,1,http://archives.estrepublicain.fr/pdf/2013/2013.1015/21-8557494951545354505256555655679969.pdf,,Président du Conseil de surveillance du Centre hospitalier de Lunéville,2,10*6*1,Lunéville,19,http://cumular.lexpress.fr/back_end/images/uploads/jacques-lamblin.jpg,1,0,,,0,0,0,0,
1211,Bretagne,56 - Morbihan,M.,Hervé,Pellois,DVG,Député du Morbihan*Maire de Saint-Avé*Conseiller délégué de la communauté d'agglomération Vannes Agglo,Député,1,,0,0,1,,,NULL,NULL,10*6*2,Saint-Avé,18,http://cumular.lexpress.fr/back_end/images/uploads/herve-pellois.jpg,1,0,,,0,0,0,0,
331,Guadeloupe,971 - Guadeloupe,M.,Ary,Chalus,DVG,Député de la Guadeloupe*Maire de Baie-Mahault,Député,1,,0,0,1,http://www.bondamanjak.com/municipales-2014-a-la-guadeloupe-la-liste-des-candidats-es/,,NULL,NULL,10*8,Baie-Mahault,18,http://cumular.lexpress.fr/back_end/images/uploads/ary-chalus.jpg,1,0,,,0,0,0,0,
1039,Guadeloupe,971 - Guadeloupe,Mme,Gabrielle,Louis-Carabin,DVG,Députée de la Guadeloupe*Maire du Moule,Député,1,,0,0,1,http://www.bondamanjak.com/municipales-2014-a-la-guadeloupe-la-liste-des-candidats-es/,,NULL,NULL,10*8,Moule,18,http://cumular.lexpress.fr/back_end/images/uploads/gabrielle-louis-carabin.jpg,1,0,,,0,0,0,0,
1478,Basse-Normandie,14 - Calvados,M.,Alain,Tourret,PRG,Député du Calvados*Maire de Moult*Conseiller délégué de la communauté de communes du Val ès Dunes,Député,1,,0,0,1,http://www.ouest-france.fr/municipales-moult-alain-tourret-annonce-sa-candidature-1849627,,"Président du 2IDHP, Institut international des droits de l'Homme et de la Paix",2,10*5*1,Moult,18,http://cumular.lexpress.fr/back_end/images/uploads/alain-tourret.jpg,1,0,,,0,0,0,0,
1020,Bretagne,22 - Côtes-d'Armor,M.,Michel,Lesage,PS,Député des Côtes-d'Armor*Maire de Langueux*Conseiller délégué de la communauté d'agglomération Saint-Brieuc Agglomération Baie d'Armor,Député,1,,0,0,1,Non-exécutif http://www.ouest-france.fr/langueux-michel-lesage-1882479,,NULL,NULL,10*6*2,Langueux,18,http://cumular.lexpress.fr/back_end/images/uploads/michel-lesage.jpg,1,0,,,0,0,0,0,
1273,Languedoc-Roussillon,30 - Gard,M.,Patrice,Prat,PS,Député du Gard*Maire de Laudun-l'Ardoise*Conseiller délégué de la communauté d'agglomération du Gard Rhodanien,Député,1,,0,0,1,,,NULL,NULL,10*6*2,Laudun-l'Ardoise,18,http://cumular.lexpress.fr/back_end/images/uploads/patrice-prat.jpg,1,0,,,0,0,0,0,
608,Lorraine,54 - Meurthe-et-Moselle,M.,Hervé,Féron,PS,Député de la Meurthe-et-Moselle*Maire de Tomblaine*Conseiller délégué de la communauté urbaine du Grand Nancy,Député,1,,0,0,1,http://herveferon.fr/index.php/tomblaine-et-la-cugn/tomblaine/1027-gros-succes-pour-la-soiree-du-ps-de-tomblaine,,NULL,NULL,10*6*2,Tomblaine,18,http://cumular.lexpress.fr/back_end/images/uploads/herve-feron.jpg,1,0,,,0,0,0,0,
1027,Lorraine,57 - Moselle,M.,Michel,Liebgott,PS,Député de la Moselle*Maire de Fameck*Conseiller délégué de la communauté d'agglomération Val de Fensch,Député,1,,0,0,1,http://www.boulangeriepatisseriegerber.fr/wp-content/uploads/2013/11/RL-Thionville-2e-page-171113.pdf,,NULL,NULL,10*6*2,Fameck,18,http://cumular.lexpress.fr/back_end/images/uploads/michel-liebgott.jpg,1,0,,,0,0,0,0,
171,Rhône-Alpes,69 - Rhône,M.,Yves,Blein,PS,Député du Rhône*Maire de Feyzin,Député,1,,0,0,1,?,,"Président d'Amaris, Association nationale des communes pour la maîtrise des risques technologiques majeurs",2,10*6,Feyzin,18,http://cumular.lexpress.fr/back_end/images/uploads/yves-blein.jpg,1,0,,,0,0,0,0,
735,Basse-Normandie,50 - Manche,Mme,Geneviève,Gosselin,PS,Députée de la Manche*Adjointe au maire de Cherbourg-Octeville*Conseillère déléguée de la communauté urbaine de Cherbourg,Député,1,,0,0,1,,,Président du Syndicat mixte du SCoT du Cotentin,2,10*4*2,Cherbourg-Octeville,18,http://cumular.lexpress.fr/back_end/images/uploads/genevieve-gosselin.jpg,0,1,,,0,0,0,0,
1437,Poitou-Charentes,17 - Charente-Maritime,Mme,Suzanne,Tallard,PS,Députée de la Charente-Maritime*Conseillère municipale d'Aytré*Conseillère déléguée de la communauté d'agglomération de La Rochelle,Député,0,,0,0,0,,,NULL,NULL,10*6*2,Aytré,18,http://cumular.lexpress.fr/back_end/images/uploads/suzanne-tallard.jpg,0,0,,,0,0,0,0,
