632,Poitou-Charentes,86 - Vienne,M.,Alain,Fouché,UMP,"Sénateur de la Vienne*Conseiller général de la Vienne, canton de Chauvigny",Sénateur,0,,0,0,0,,,Président du Syndicat mixte Vienne Services,2,10*4,NULL,16,http://cumular.lexpress.fr/back_end/images/uploads/fouche-alain.jpg,0,0,,,0,0,0,0,
499,Ile-de-France,75 - Paris,M.,Jean,Desessard,Verts,Sénateur de Paris,Sénateur,0,,0,0,0,,,Secrétaire du Sénat*Membre du bureau exécutif d'Europe écologie Les Verts,3*3,10,NULL,16,http://cumular.lexpress.fr/back_end/images/uploads/desessard-jean.jpg,0,0,,,0,0,0,0,
1099,Lorraine,57 - Moselle,M.,Jean Louis,Masson,DVD,"Sénateur de la Moselle*Conseiller municipal de Nouilly*Conseiller général de la Moselle, canton de Vigy",Sénateur,0,,0,0,0,,,NULL,NULL,10*1*4,Nouilly,15,http://cumular.lexpress.fr/back_end/images/uploads/masson-jean-louis.jpg,0,0,,,0,0,0,0,
156,Rhône-Alpes,26 - Drôme,M.,Jean,Besson,PS,Sénateur de la Drôme,Sénateur,0,,0,0,0,,,"Président d'Energie SDED, Syndicat départementale des énergies de la Drôme*Président du Comité régional du tourisme Rhône-Alpes",2*3,10,NULL,15,http://cumular.lexpress.fr/back_end/images/uploads/besson-jean.jpg,0,0,,,0,0,0,0,
301,Aquitaine,40 - Landes,M.,Jean-Louis,Carrère,PS,Sénateur des Landes,Sénateur,0,,0,0,0,,,Président de la commission des affaires étrangères du Sénat*Président du Pays Adour Chalosse Tursan (Landes).,3*2,10,NULL,15,http://cumular.lexpress.fr/back_end/images/uploads/carrere-jean-louis.jpg,0,0,,,0,0,0,0,
882,Ile-de-France,75 - Paris,Mme,Bariza,Khiari,PS,Sénatrice de Paris*Conseillère municipale du XVIe arrondissement de Paris,Sénateur,0,,0,0,0,,,Vice-présidente du Sénat,3,10*2,XVIe arrondissement de Paris,15,http://cumular.lexpress.fr/back_end/images/uploads/khiari-bariza.jpg,0,0,,,0,0,0,0,
1520,Réunion,974 - Réunion,M.,Paul,Vergès,PCR,Sénateur de la Réunion,Sénateur,0,,0,0,0,,,"Président de l'ARER, Agence régionale de l'énergie de La Réunion*Président de l'ONERC, Observatoire national sur les effets du réchauffement climatique",2*2,10,NULL,14,http://cumular.lexpress.fr/back_end/images/uploads/verges-paul.jpg,0,0,,,0,0,0,0,
411,Rhône-Alpes,42 - Loire,Mme,Cécile,Cukierman,PCF,Sénatrice de la Loire*Conseillère régionale de Rhône-Alpes,Sénateur,0,,0,0,0,,,NULL,NULL,10*4,NULL,14,http://cumular.lexpress.fr/back_end/images/uploads/cukierman-cecile.jpg,0,0,,,0,0,0,0,
1245,Midi-Pyrénées,31 - Haute-Garonne,M.,Jean-Pierre,Plancade,PRG,"Sénateur de la Haute-Garonne*Conseiller général de la Haute-Garonne, canton de Toulouse 6",Sénateur,0,,0,0,0,http://midi-pyrenees.france3.fr/2013/10/15/municipales-2014-le-senateur-plancade-candidat-toulouse-et-aussitot-exclu-du-prg-339225.html,,NULL,NULL,10*4,NULL,14,http://cumular.lexpress.fr/back_end/images/uploads/plancade-jean-pierre.jpg,0,0,,,0,0,0,0,
725,Basse-Normandie,50 - Manche,M.,Jean-Pierre,Godefroy,PS,Sénateur de la Manche*Conseiller régional de Basse-Normandie,Sénateur,0,,0,0,0,,,NULL,NULL,10*4,NULL,14,http://cumular.lexpress.fr/back_end/images/uploads/godefroy-jean-pierre.jpg,0,0,,,0,0,0,0,
275,Ile-de-France,75 - Paris,M.,Jean-Pierre,Caffet,PS,Sénateur de Paris*Conseiller de Paris,Sénateur,0,,0,0,0,http://actionbarbes.blogspirit.com/archive/2013/10/02/pre-municipales-2014-situation-dans-le-18e-2979953.html,,NULL,NULL,10*4,NULL,14,http://cumular.lexpress.fr/back_end/images/uploads/caffet-jean-pierre.jpg,0,0,,,0,0,0,0,
514,Ile-de-France,93 - Seine-Saint-Denis,M.,Claude,Dilain,PS,"Sénateur de la Seine-Saint-Denis*Conseiller général de la Seine-Saint-Denis, canton de Clichy-sous-Bois",Sénateur,0,,0,0,0,,,NULL,NULL,10*4,NULL,14,http://cumular.lexpress.fr/back_end/images/uploads/dilain-claude.jpg,0,0,,,0,0,0,0,
1348,Ile-de-France,93 - Seine-Saint-Denis,M.,Gilbert,Roger,PS,"Sénateur de la Seine-Saint-Denis*Conseiller général de la Seine-Saint-Denis, canton de Bondy-Sud-Est",Sénateur,0,,0,0,0,,,NULL,NULL,10*4,NULL,14,http://cumular.lexpress.fr/back_end/images/uploads/roger-gilbert.jpg,0,0,,,0,0,0,0,
1446,Ile-de-France,78 - Yvelines,Mme,Catherine,Tasca,PS,Sénatrice des Yvelines,Sénateur,0,,0,0,0,,,"Présidente de l'association Ballet d'Europe*Présidente de l'association Éclat, Festival international de rue d'Aurillac",2*2,10,NULL,14,http://cumular.lexpress.fr/back_end/images/uploads/tasca-catherine.jpg,0,0,,,0,0,0,0,
1127,Pays de la Loire,44 - Loire-Atlantique,Mme,Michelle,Meunier,PS,"Sénatrice de la Loire-Atlantique*Conseillère générale de la Loire-Atlantique, canton de Nantes 2",Sénateur,0,,0,0,0,,,NULL,NULL,10*4,NULL,14,http://cumular.lexpress.fr/back_end/images/uploads/meunier-michelle.jpg,0,0,,,0,0,0,0,
100,Nord-Pas-de-Calais,59 - Nord,Mme,Delphine,Bataille,PS,"Sénatrice du Nord*Conseillère générale du Nord, canton de Carnières",Sénateur,0,,0,0,0,,,NULL,NULL,10*4,NULL,14,http://cumular.lexpress.fr/back_end/images/uploads/bataille-delphine.jpg,0,0,,,0,0,0,0,
35,Auvergne,63 - Puy-de-Dôme,Mme,Michèle,André,PS,"Sénatrice du Puy-de-Dôme*Conseillère générale du Puy-de-Dôme, canton de Clermont-Ferrand-Nord-Ouest",Sénateur,0,,0,0,0,,,NULL,NULL,10*4,NULL,14,http://cumular.lexpress.fr/back_end/images/uploads/andre-michele.jpg,0,0,,,0,0,0,0,
284,Ile-de-France,91 - Essonne,Mme,Claire-Lise,Campion,PS,"Sénatrice de l'Essonne*Conseillère générale de l'Essonne, canton d'Etréchy",Sénateur,0,,0,0,0,,,NULL,NULL,10*4,NULL,14,http://cumular.lexpress.fr/back_end/images/uploads/campion-claire-lise.jpg,0,0,,,0,0,0,0,
1272,Ile-de-France,75 - Paris,M.,Yves,Pozzo di Borgo,UDI,Sénateur de Paris*Conseiller de Paris,Sénateur,0,,0,0,0,,,NULL,NULL,10*4,NULL,14,http://cumular.lexpress.fr/back_end/images/uploads/pozzo-di-borgo-yves.jpg,0,0,,,0,0,0,0,
1152,Haute-Normandie,76 - Seine-Maritime,Mme,Catherine,Morin-Desailly,UDI,Sénatrice de la Seine-Maritime*Conseillère régionale de Haute-Normandie,Sénateur,0,,0,0,0,,,NULL,NULL,10*4,NULL,14,http://cumular.lexpress.fr/back_end/images/uploads/morin-desailly-catherine.jpg,0,0,,,0,0,0,0,
198,Bourgogne,89 - Yonne,M.,Pierre,Bordier,UMP,"Sénateur de l'Yonne*Conseiller général de l'Yonne, canton de Saint-Fargeau",Sénateur,0,,0,0,0,,,NULL,NULL,10*4,NULL,14,http://cumular.lexpress.fr/back_end/images/uploads/bordier-pierre.jpg,0,0,,,0,0,0,0,
875,Alsace,67 - Bas-Rhin,Mme,Fabienne,Keller,UMP,Sénatrice du Bas-Rhin*Conseillère municipale de Strasbourg*Conseillère déléguée de la communauté urbaine de Strasbourg,Sénateur,0,,0,0,0,http://www.rue89strasbourg.com/index.php/2013/12/23/politique/municipales-fabienne-keller-recolte-les-doleances/,,NULL,NULL,10*2*2,Strasbourg,14,http://cumular.lexpress.fr/back_end/images/uploads/keller-fabienne.jpg,0,0,,,0,0,0,0,
493,Pays de la Loire,49 - Maine-et-Loire,Mme,Catherine,Deroche,UMP,Sénatrice du Maine-et-Loire*Conseillère régionale des Pays de la Loire,Sénateur,0,,0,0,0,,,NULL,NULL,10*4,NULL,14,http://cumular.lexpress.fr/back_end/images/uploads/deroche-catherine.jpg,0,0,,,0,0,0,0,
421,Pays de la Loire,44 - Loire-Atlantique,M.,Ronan,Dantec,Verts,Sénateur de la Loire-Atlantique*Conseiller municipal de Nantes*Conseiller délégué de la communauté urbaine Nantes métropole,Sénateur,0,,0,0,0,http://www.ouest-france.fr/municipales-nantes-les-candidats-europe-ecologie-les-verts-1805900,,NULL,NULL,10*2*2,Nantes,14,http://cumular.lexpress.fr/back_end/images/uploads/dantec-ronan.jpg,0,0,,,0,0,0,0,
352,Franche-Comté,90 - Territoire de Belfort,M.,Jean-Pierre,Chevènement,DVG,Sénateur du Territoire de Belfort,Sénateur,0,,0,0,0,,,Président de la Fondation Res Publica*Président de l'Association France-Algérie,2*1,10,NULL,13,http://cumular.lexpress.fr/back_end/images/uploads/chevenement-jean-pierre.jpg,0,0,,,0,0,0,0,
401,Languedoc-Roussillon,11 - Aude,M.,Roland,Courteau,PS,Sénateur de l'Aude,Sénateur,0,,0,0,0,,,Président du Conseil supérieur de l'Energie,3,10,NULL,13,http://cumular.lexpress.fr/back_end/images/uploads/courteau-roland.jpg,0,0,,,0,0,0,0,
1434,Languedoc-Roussillon,30 - Gard,M.,Simon,Sutour,PS,Sénateur du Gard,Sénateur,0,,0,0,0,,,Président de la commission des affaires européennes du Sénat,3,10,NULL,13,http://cumular.lexpress.fr/back_end/images/uploads/sutour-simon.jpg,0,0,,,0,0,0,0,
1431,Centre,45 - Loiret,M.,Jean-Pierre,Sueur,PS,Sénateur du Loiret,Sénateur,0,,0,0,0,,,Président de la commission des lois du Sénat,3,10,NULL,13,http://cumular.lexpress.fr/back_end/images/uploads/sueur-jean-pierre.jpg,0,0,,,0,0,0,0,
828,Franche-Comté,25 - Doubs,M.,Jean-François,Humbert,UMP,Sénateur du Doubs,Sénateur,0,,0,0,0,http://www.macommune.info/article/municipales-a-besancon-jean-francois-humbert-veut-donner-un-sens-aux-vote-des-bisontins-9351,,Secrétaire du Sénat,3,10,NULL,13,http://cumular.lexpress.fr/back_end/images/uploads/humbert-jean-francois.jpg,0,0,,,0,0,0,0,
287,Français établis hors de France,999 - Français établis hors de France,M.,Jean-Pierre,Cantegrit,UMP,Sénateur des Français établis hors de France,Sénateur,0,,0,0,0,,,"Président de la CFE, Caisse de sécurité sociale des Français de l'étranger",3,10,NULL,13,http://cumular.lexpress.fr/back_end/images/uploads/cantegrit-jean-pierre.jpg,0,0,,,0,0,0,0,
169,Nord-Pas-de-Calais,59 - Nord,Mme,Marie-Christine,Blandin,Verts,Sénatrice du Nord,Sénateur,0,,0,0,0,,,"Présidente de la commission de la culture, de l'éducation et de la communication du Sénat",3,10,NULL,13,http://cumular.lexpress.fr/back_end/images/uploads/blandin-marie-christine.jpg,0,0,,,0,0,0,0,
1050,Auvergne,63 - Puy-de-Dôme,M.,Jacques-Bernard,Magner,PS,Sénateur du Puy-de-Dôme,Sénateur,0,,0,0,0,,,"Président de l'Association Auvergne active, aide à la création d'entreprises",2,10,NULL,12,http://cumular.lexpress.fr/back_end/images/uploads/magner-jacques-bernard.jpg,0,0,,,0,0,0,0,
1195,Midi-Pyrénées,81 - Tarn,M.,Jean-Marc,Pastor,PS,Sénateur du Tarn,Sénateur,0,,0,0,0,,,"Président du Trifyl, syndicat mixte départemental de valorisation des déchets ménagers ",2,10,NULL,12,http://cumular.lexpress.fr/back_end/images/uploads/pastor-jean-marc.jpg,0,0,,,0,0,0,0,
1392,Rhône-Alpes,38 - Isère,M.,Bernard,Saugey,UMP,Sénateur de l'Isère,Sénateur,0,,0,0,0,,,Président de la fraternelle parlementaire,2,10,NULL,12,http://cumular.lexpress.fr/back_end/images/uploads/saugey-bernard.jpg,0,0,,,0,0,0,0,
90,Franche-Comté,39 - Jura,M.,Gilbert,Barbier,UMP,Sénateur du Jura*Conseiller municipal de Dole,Sénateur,0,,0,0,0,,,NULL,NULL,10*2,Dole,12,http://cumular.lexpress.fr/back_end/images/uploads/barbier-gilbert.jpg,0,0,,,0,0,0,0,
524,Ile-de-France,75 - Paris,M.,Philippe,Dominati,UMP,Sénateur de Paris*Conseiller municipal du VIIIe arrondissement de Paris,Sénateur,0,,0,0,0,,,NULL,NULL,10*2,VIIIe arrondissement de Paris,12,http://cumular.lexpress.fr/back_end/images/uploads/dominati-philippe.jpg,0,0,,,0,0,0,0,
656,Nouvelle-Calédonie,988 - Nouvelle-Calédonie,M.,Pierre,Frogier,UMP,Sénateur de la Nouvelle-Calédonie,Sénateur,0,,0,0,0,,,Président de la SEM de Tina,2,10,NULL,12,http://cumular.lexpress.fr/back_end/images/uploads/frogier-pierre.jpg,0,0,,,0,0,0,0,
572,Français établis hors de France,999 - Français établis hors de France,M.,Louis,Duvernois,UMP,Sénateur des Français établis hors de France,Sénateur,0,,0,0,0,,,"Président d'ADIFLOR, Association pour la diffusion internationale francophone de livres ouvrages et revues",2,10,NULL,12,http://cumular.lexpress.fr/back_end/images/uploads/duvernois-louis.jpg,0,0,,,0,0,0,0,
609,Français établis hors de France,999 - Français établis hors de France,M.,André,Ferrand,UMP,Sénateur des Français établis hors de France,Sénateur,0,,0,0,0,,,"Président de l'ANEFE, Association nationale des écoles françaises à l'étranger",2,10,NULL,12,http://cumular.lexpress.fr/back_end/images/uploads/ferrand-andre.jpg,0,0,,,0,0,0,0,
675,Français établis hors de France,999 - Français établis hors de France,Mme,Joêlle,Garriaud-Maylam,UMP,Sénatrice des Français établis hors de France,Sénateur,0,,0,0,0,,,Conseillère politique de l'UMP,2,10,NULL,12,http://cumular.lexpress.fr/back_end/images/uploads/garriaud-maylam-joelle.jpg,0,0,,,0,0,0,0,
825,Ile-de-France,95 - Val-d'Oise,M.,Robert,Hue,DVG,Sénateur du Val-d'Oise*Conseiller municipal de Montigny-lès-Cormeilles,Sénateur,0,,0,0,0,? http://www.leparisien.fr/municipales-2014/paris-75/municipales-a-paris-robert-hue-menace-de-se-presenter-dans-le-xive-14-12-2013-3409305.php,,NULL,NULL,10*1,Montigny-lès-Cormeilles,11,http://cumular.lexpress.fr/back_end/images/uploads/hue-robert.jpg,0,0,,,0,0,0,0,
1491,Polynésie française,987 - Polynésie française,M.,Richard,Tuheiava,DVG,Sénateur de la Polynésie française*Conseiller municipal d'Arue,Sénateur,0,,0,0,0,http://polynesie.la1ere.fr/2013/11/26/richard-tuheiava-ne-se-representera-pas-aux-senatoriales-88805.html,Mairie,NULL,NULL,10*1,Arue,11,http://cumular.lexpress.fr/back_end/images/uploads/tuheiava-richard.jpg,0,0,,,0,0,0,0,
123,Midi-Pyrénées,09 - Ariège,M.,Jean-Pierre,Bel,PS,Sénateur de l'Ariège,Sénateur,0,,0,0,0,,,Président de l'Association des maires et des élus de l'Ariège,1,10,NULL,11,http://cumular.lexpress.fr/back_end/images/uploads/bel-jean-pierre.jpg,0,0,,,0,0,0,0,
1295,Languedoc-Roussillon,11 - Aude,M.,Marcel,Rainaud,PS,Sénateur de l'Aude*Conseiller municipal de Talairan,Sénateur,0,,0,0,0,,,NULL,NULL,10*1,Talairan,11,http://cumular.lexpress.fr/back_end/images/uploads/rainaud-marcel.jpg,0,0,,,0,0,0,0,
229,Limousin,19 - Corrèze,Mme,Bernadette,Bourzai,PS,Sénatrice de la Corrèze*Conseillère municipale d'Egletons,Sénateur,0,,0,0,0,,,NULL,NULL,10*1,Egletons,11,http://cumular.lexpress.fr/back_end/images/uploads/bourzai-bernadette.jpg,0,0,,,0,0,0,0,
305,Aquitaine,33 - Gironde,Mme,Françoise,Cartron,PS,Sénatrice de la Gironde*Conseillère municipale d'Artigues-près-Bordeaux,Sénateur,0,,0,0,0,,,NULL,NULL,10*1,Artigues-près-Bordeaux,11,http://cumular.lexpress.fr/back_end/images/uploads/cartron-francoise.jpg,0,0,,,0,0,0,0,
576,Bourgogne,58 - Nièvre,Mme,Anne,Emery-Dumas,PS,Sénatrice de la Nièvre,Sénateur,0,,0,0,0,,,Présidente de l'association « Femmes d'ici et d'ailleurs »,1,10,NULL,11,http://cumular.lexpress.fr/back_end/images/uploads/emery-dumas-anne.jpg,0,0,,,0,0,0,0,
142,Provence-Alpes-Côte d'Azur,05 - Hautes-Alpes,M.,Pierre,Bernard-Reymond,UMP,Sénateur des Hautes-Alpes,Sénateur,0,,0,0,0,,,Président du Comité de ligne Briançon-Paris-Briançon,1,10,NULL,11,http://cumular.lexpress.fr/back_end/images/uploads/bernard-reymond-pierre.jpg,0,0,,,0,0,0,0,
220,Haute-Normandie,27 - Eure,M.,Joêl,Bourdin,UMP,Sénateur de l'Eure,Sénateur,0,,0,0,0,,,Président de l'Union des maires et des élus de l'Eure,1,10,NULL,11,http://cumular.lexpress.fr/back_end/images/uploads/bourdin-joel.jpg,0,0,,,0,0,0,0,
1140,Mayotte,976 - Mayotte,M.,Thani,Mohamed Soilihi,DVG,Sénateur de Mayotte,Sénateur,0,,0,0,0,,,NULL,NULL,10,NULL,10,http://cumular.lexpress.fr/back_end/images/uploads/mohamed-soilihi-thani.jpg,0,0,,,0,0,0,0,
617,Rhône-Alpes,69 - Rhône,M.,Guy,Fischer,PCF,Sénateur du Rhône,Sénateur,0,,0,0,0,,,NULL,NULL,10,NULL,10,http://cumular.lexpress.fr/back_end/images/uploads/fischer-guy.jpg,0,0,,,0,0,0,0,
1194,Provence-Alpes-Côte d'Azur,13 - Bouches-du-Rhône,Mme,Isabelle,Pasquet,PCF,Sénatrice des Bouches-du-Rhône,Sénateur,0,,0,0,0,http://www.humanite.fr/politique/les-visages-de-marseille-gauche-556757,,NULL,NULL,10,NULL,10,http://cumular.lexpress.fr/back_end/images/uploads/pasquet-isabelle.jpg,0,0,,,0,0,0,0,
731,Ile-de-France,92 - Hauts-de-Seine,Mme,Brigitte,Gonthier-Maurin,PCF,Sénatrice des Hauts-de-Seine,Sénateur,0,,0,0,0,,,NULL,NULL,10,NULL,10,http://cumular.lexpress.fr/back_end/images/uploads/gonthier-maurin-brigitte.jpg,0,0,,,0,0,0,0,
378,Midi-Pyrénées,82 - Tarn-et-Garonne,M.,Yvon,Collin,PRG,Sénateur du Tarn-et-Garonne,Sénateur,0,,0,0,0,,,NULL,NULL,10,NULL,10,http://cumular.lexpress.fr/back_end/images/uploads/collin-yvon.jpg,0,0,,,0,0,0,0,
1456,Rhône-Alpes,07 - Ardèche,M.,Michel,Teston,PS,Sénateur de l'Ardèche,Sénateur,0,,0,0,0,,,NULL,NULL,10,NULL,10,http://cumular.lexpress.fr/back_end/images/uploads/teston-michel.jpg,0,0,,,0,0,0,0,
807,Bretagne,35 - Ille-et-Vilaine,M.,Edmond,Hervé,PS,Sénateur de l'Ille-et-Vilaine,Sénateur,0,,0,0,0,,,NULL,NULL,10,NULL,10,http://cumular.lexpress.fr/back_end/images/uploads/herve-edmond.jpg,0,0,,,0,0,0,0,
968,Bretagne,35 - Ille-et-Vilaine,M.,Jacky,Le Menn,PS,Sénateur de l'Ille-et-Vilaine,Sénateur,0,,0,0,0,,,NULL,NULL,10,NULL,10,http://cumular.lexpress.fr/back_end/images/uploads/le-menn-jacky.jpg,0,0,,,0,0,0,0,
1510,Pays de la Loire,44 - Loire-Atlantique,M.,Yannick,Vaugrenard,PS,Sénateur de la Loire-Atlantique,Sénateur,0,,0,0,0,,,NULL,NULL,10,NULL,10,http://cumular.lexpress.fr/back_end/images/uploads/vaugrenard-yannick.jpg,0,0,,,0,0,0,0,
1304,Lorraine,54 - Meurthe-et-Moselle,M.,Daniel,Reiner,PS,Sénateur de la Meurthe-et-Moselle,Sénateur,0,,0,0,0,,,NULL,NULL,10,NULL,10,http://cumular.lexpress.fr/back_end/images/uploads/reiner-daniel.jpg,0,0,,,0,0,0,0,
1132,Franche-Comté,70 - Haute-Saône,M.,Jean-Pierre,Michel,PS,Sénateur de la Haute-Saône,Sénateur,0,,0,0,0,,,NULL,NULL,10,NULL,10,http://cumular.lexpress.fr/back_end/images/uploads/michel-jean-pierre.jpg,0,0,,,0,0,0,0,
483,Limousin,87 - Haute-Vienne,M.,Jean-Pierre,Demerliat,PS,Sénateur de la Haute-Vienne,Sénateur,0,,0,0,0,,,NULL,NULL,10,NULL,10,http://cumular.lexpress.fr/back_end/images/uploads/demerliat-jean-pierre.jpg,0,0,,,0,0,0,0,
928,Martinique,972 - Martinique,M.,Serge,Larcher,PS,Sénateur de la Martinique,Sénateur,0,,0,0,0,,,NULL,NULL,10,NULL,10,http://cumular.lexpress.fr/back_end/images/uploads/larcher-serge.jpg,0,0,,,0,0,0,0,
1524,Réunion,974 - Réunion,M.,Michel,Vergoz,PS,Sénateur de la Réunion,Sénateur,0,,0,0,0,http://www.linfo.re/571335-Les-enjeux-des-municipales-a-Sainte-Rose,,NULL,NULL,10,NULL,10,http://cumular.lexpress.fr/back_end/images/uploads/vergoz-michel.jpg,0,0,,,0,0,0,0,
984,Français établis hors de France,999 - Français établis hors de France,M.,Jean-Yves,Leconte,PS,Sénateur des Français établis hors de France,Sénateur,0,,0,0,0,,,NULL,NULL,10,NULL,10,http://cumular.lexpress.fr/back_end/images/uploads/leconte-jean-yves.jpg,0,0,,,0,0,0,0,
1564,Français établis hors de France,999 - Français établis hors de France,M.,Richard,Yung,PS,Sénateur des Français établis hors de France,Sénateur,0,,0,0,0,,,NULL,NULL,10,NULL,10,http://cumular.lexpress.fr/back_end/images/uploads/yung-richard.jpg,0,0,,,0,0,0,0,
1031,Ile-de-France,77 - Seine-et-Marne,Mme,Hélène,Lipietz,PS,Sénatrice de la Seine-et-Marne,Sénateur,0,,0,0,0,,,NULL,NULL,10,NULL,10,http://cumular.lexpress.fr/back_end/images/uploads/lipietz-helene.jpg,0,0,,,0,0,0,0,
27,Midi-Pyrénées,81 - Tarn,Mme,Jacqueline,Alquier,PS,Sénatrice du Tarn,Sénateur,0,,0,0,0,,,NULL,NULL,10,NULL,10,http://cumular.lexpress.fr/back_end/images/uploads/alquier-jacqueline.jpg,0,0,,,0,0,0,0,
1006,Français établis hors de France,999 - Français établis hors de France,Mme,Claudine,Lepage,PS,Sénatrice des Français établis hors de France,Sénateur,0,,0,0,0,,,NULL,NULL,10,NULL,10,http://cumular.lexpress.fr/back_end/images/uploads/lepage-claudine.jpg,0,0,,,0,0,0,0,
491,Picardie,80 - Somme,M.,Marcel,Deneux,UDI,Sénateur de la Somme,Sénateur,0,,0,0,0,,,NULL,NULL,10,NULL,10,http://cumular.lexpress.fr/back_end/images/uploads/deneux-marcel.jpg,0,0,,,0,0,0,0,
743,Basse-Normandie,61 - Orne,Mme,Nathalie,Goulet,UDI,Sénatrice de l'Orne,Sénateur,0,,0,0,0,,,NULL,NULL,10,NULL,10,http://cumular.lexpress.fr/back_end/images/uploads/goulet-nathalie.jpg,0,0,,,0,0,0,0,
517,Rhône-Alpes,69 - Rhône,Mme,Muguette,Dini,UDI,Sénatrice du Rhône,Sénateur,0,,0,0,0,,,NULL,NULL,10,NULL,10,http://cumular.lexpress.fr/back_end/images/uploads/dini-muguette.jpg,0,0,,,0,0,0,0,
666,Champagne-Ardenne,10 - Aube,M.,Yann,Gaillard,UMP,Sénateur de l'Aube,Sénateur,0,,0,0,0,,,NULL,NULL,10,NULL,10,http://cumular.lexpress.fr/back_end/images/uploads/gaillard-yann.jpg,0,0,,,0,0,0,0,
674,Basse-Normandie,14 - Calvados,M.,René,Garrec,UMP,Sénateur du Calvados,Sénateur,0,,0,0,0,,,NULL,NULL,10,NULL,10,http://cumular.lexpress.fr/back_end/images/uploads/garrec-rene.jpg,0,0,,,0,0,0,0,
1163,Lorraine,54 - Meurthe-et-Moselle,M.,Philippe,Nachbar,UMP,Sénateur de la Meurthe-et-Moselle,Sénateur,0,,0,0,0,,,NULL,NULL,10,NULL,10,http://cumular.lexpress.fr/back_end/images/uploads/nachbar-philippe.jpg,0,0,,,0,0,0,0,
1492,Nord-Pas-de-Calais,59 - Nord,M.,Alex,Türk,UMP,Sénateur du Nord,Sénateur,0,,0,0,0,,,NULL,NULL,10,NULL,10,http://cumular.lexpress.fr/back_end/images/uploads/turk-alex.jpg,0,0,,,0,0,0,0,
578,Bourgogne,71 - Saône-et-Loire,M.,Jean-Paul,Emorine,UMP,Sénateur de la Saône-et-Loire,Sénateur,0,,0,0,0,,,NULL,NULL,10,NULL,10,http://cumular.lexpress.fr/back_end/images/uploads/emorine-jean-paul.jpg,0,0,,,0,0,0,0,
366,Pays de la Loire,72 - Sarthe,M.,Marcel-Pierre,Cléach,UMP,Sénateur de la Sarthe,Sénateur,0,,0,0,0,,,NULL,NULL,10,NULL,10,http://cumular.lexpress.fr/back_end/images/uploads/cleach-marcel-pierre.jpg,0,0,,,0,0,0,0,
121,Poitou-Charentes,79 - Deux-Sèvres,M.,Michel,Bécot,UMP,Sénateur des Deux-Sèvres,Sénateur,0,,0,0,0,,,NULL,NULL,10,NULL,10,http://cumular.lexpress.fr/back_end/images/uploads/becot-michel.jpg,0,0,,,0,0,0,0,
549,Poitou-Charentes,79 - Deux-Sèvres,M.,André,Dulait,UMP,Sénateur des Deux-Sèvres,Sénateur,0,,0,0,0,,,NULL,NULL,10,NULL,10,http://cumular.lexpress.fr/back_end/images/uploads/dulait-andre.jpg,0,0,,,0,0,0,0,
1489,Provence-Alpes-Côte d'Azur,83 - Var,M.,François,Trucy,UMP,Sénateur du Var,Sénateur,0,,0,0,0,,,NULL,NULL,10,NULL,10,http://cumular.lexpress.fr/back_end/images/uploads/trucy-francois.jpg,0,0,,,0,0,0,0,
427,Ile-de-France,91 - Essonne,M.,Serge,Dassault,UMP,Sénateur de l'Essonne,Sénateur,0,,0,0,0,,,NULL,NULL,10,NULL,10,http://cumular.lexpress.fr/back_end/images/uploads/dassault-serge.jpg,0,0,,,0,0,0,0,
1052,Saint-Barthélémy,977 - Saint-Barthélémy,M.,Michel,Magras,UMP,Sénateur de Saint-Barthélémy,Sénateur,0,,0,0,0,,,NULL,NULL,10,NULL,10,http://cumular.lexpress.fr/back_end/images/uploads/magras-michel.jpg,0,0,,,0,0,0,0,
932,Wallis et Futuna,989 - Wallis et Futuna,M.,Robert,Laufoaulu,UMP,Sénateur de Wallis et Futuna,Sénateur,0,,0,0,0,,,NULL,NULL,10,NULL,10,http://cumular.lexpress.fr/back_end/images/uploads/laufoaulu-robert.jpg,0,0,,,0,0,0,0,
376,Français établis hors de France,999 - Français établis hors de France,M.,Christian,Cointat,UMP,Sénateur des Français établis hors de France,Sénateur,0,,0,0,0,,,NULL,NULL,10,NULL,10,http://cumular.lexpress.fr/back_end/images/uploads/cointat-christian.jpg,0,0,,,0,0,0,0,
464,Français établis hors de France,999 - Français établis hors de France,M.,Robert,del Picchia,UMP,Sénateur des Français établis hors de France,Sénateur,0,,0,0,0,,,NULL,NULL,10,NULL,10,http://cumular.lexpress.fr/back_end/images/uploads/del-picchia-robert.jpg,0,0,,,0,0,0,0,
652,Français établis hors de France,999 - Français établis hors de France,M.,Christophe-André,Frassa,UMP,Sénateur des Français établis hors de France,Sénateur,0,,0,0,0,,,NULL,NULL,10,NULL,10,http://cumular.lexpress.fr/back_end/images/uploads/frassa-christophe-andre.jpg,0,0,,,0,0,0,0,
870,Français établis hors de France,999 - Français établis hors de France,Mme,Christiane,Kammermann,UMP,Sénatrice des Français établis hors de France,Sénateur,0,,0,0,0,,,NULL,NULL,10,NULL,10,http://cumular.lexpress.fr/back_end/images/uploads/kammermann-christiane.jpg,0,0,,,0,0,0,0,
678,Ile-de-France,92 - Hauts-de-Seine,M.,André,Gattolin,Verts,Sénateur des Hauts-de-Seine,Sénateur,0,,0,0,0,,,NULL,NULL,10,NULL,10,http://cumular.lexpress.fr/back_end/images/uploads/gattolin-andre.jpg,0,0,,,0,0,0,0,
209,Pays de la Loire,49 - Maine-et-Loire,Mme,Corinne,Bouchoux,Verts,Sénatrice du Maine-et-Loire,Sénateur,0,,0,0,0,,,NULL,NULL,10,NULL,10,http://cumular.lexpress.fr/back_end/images/uploads/bouchoux-corinne.jpg,0,0,,,0,0,0,0,
13,Ile-de-France,75 - Paris,Mme,Leila,Aïchi,Verts,Sénatrice de Paris,Sénateur,0,,0,0,0,,,NULL,NULL,10,NULL,10,http://cumular.lexpress.fr/back_end/images/uploads/aichi-leila.jpg,0,0,,,0,0,0,0,
130,Ile-de-France,94 - Val-de-Marne,Mme,Esther,Benbassa,Verts,Sénatrice du Val-de-Marne,Sénateur,0,,0,0,0,,,NULL,NULL,10,NULL,10,http://cumular.lexpress.fr/back_end/images/uploads/benbassa-esther.jpg,0,0,,,0,0,0,0,
40,Français établis hors de France,999 - Français établis hors de France,Mme,Kalliopi,Ango Ela,Verts,Sénatrice des Français établis hors de France,Sénateur,0,,0,0,0,,,NULL,NULL,10,NULL,10,http://cumular.lexpress.fr/back_end/images/uploads/ango-ela-kalliopi.jpg,0,0,,,0,0,0,0,
1200,Bourgogne,58 - Nièvre,M.,Christian,Paul,PS,Député de la Nièvre*Conseiller municipal de Lormes*Conseiller délégué de la communauté de communes des Portes du Morvan*Vice-président du conseil régional de Bourgogne,Député,0,,1,0,1,,,Président du Syndicat mixte du Pays Nivernais – Morvan*Président du Laboratoire des idées du PS,2*3,10*1*1*4,Lormes,21,http://cumular.lexpress.fr/back_end/images/uploads/christian-paul.jpg,0,0,,,0,0,0,0,1
577,Aquitaine,40 - Landes,M.,Henri,Emmanuelli,PS,"Député des Landes*Président du conseil général des Landes, canton de Mugron",Député,0,1,0,0,1,,,"Président de la Société publique locale Domolandes*Président d'Enerlandes*Président du Syndicat mixte pour l'aménagement du parc d'Abesse*Président du Syndicat mixte ALPI, Agence landaise pour l'informatique*Président du Syndicat mixte de Gestion des milieux naturels",2*2*2*2*2,10*10,NULL,30,http://cumular.lexpress.fr/back_end/images/uploads/henri-emmanuelli.jpg,0,0,,1,0,0,0,0,
